{
  "artifact_sha256": "e04bf55ba6df75d1e6429fa3df39ddbd8f6fd825ba7d4c95752d264afc87064b",
  "automatic_selection": false,
  "characterization_id": "analysis-query-event.direct-plan@1",
  "corpus": {
    "case_count": 4,
    "case_ids": [
      "success",
      "empty",
      "contract_drift",
      "runtime_failure"
    ],
    "cases": [
      {
        "baseline": {
          "allowed_claims_sha256": "34ebc8c02f94cdbc106c082fb9adf1bd09adee591296e90b9802410f17cfcecf",
          "completeness_sha256": "55706bb7177c31d0b21a93023995acf8af0e47a570913cad6c68b7fc0af56500",
          "data_quality_sha256": "b2520349fe7e606950ae3d459dd1f02c3fdc34cf8ef167ef87ca38dcac5a2fdd",
          "freshness_sha256": "f5354207295b0460efe4a3ed41d5e52c842729184f0be30b1fd8af66489b66b9",
          "input_sha256": "4931ba38f0020f80d477b73726767caa62c42898ce94b0204a98c9b691d38665",
          "journey_sha256": "33eee4cfaafc0a0aeab6048cef995cf405cb095c23bd504bd86f4a1b34c2055b",
          "output_sha256": "16acefbddcd6b1dda98a10794b61191b4e9f8d19ef87aad2b8785bd46b9410fd",
          "privacy_sha256": "a6d3c0d70f0d6569e57fb1114a05bfec6cba2b646b79bf8b55785d2a42d3e7bb",
          "request_count": 1
        },
        "candidate": {
          "allowed_claims_sha256": "34ebc8c02f94cdbc106c082fb9adf1bd09adee591296e90b9802410f17cfcecf",
          "completeness_sha256": "55706bb7177c31d0b21a93023995acf8af0e47a570913cad6c68b7fc0af56500",
          "data_quality_sha256": "b2520349fe7e606950ae3d459dd1f02c3fdc34cf8ef167ef87ca38dcac5a2fdd",
          "freshness_sha256": "f5354207295b0460efe4a3ed41d5e52c842729184f0be30b1fd8af66489b66b9",
          "input_sha256": "4931ba38f0020f80d477b73726767caa62c42898ce94b0204a98c9b691d38665",
          "journey_sha256": "33eee4cfaafc0a0aeab6048cef995cf405cb095c23bd504bd86f4a1b34c2055b",
          "output_sha256": "16acefbddcd6b1dda98a10794b61191b4e9f8d19ef87aad2b8785bd46b9410fd",
          "privacy_sha256": "a6d3c0d70f0d6569e57fb1114a05bfec6cba2b646b79bf8b55785d2a42d3e7bb",
          "request_count": 1
        },
        "case_id": "success"
      },
      {
        "baseline": {
          "allowed_claims_sha256": "34ebc8c02f94cdbc106c082fb9adf1bd09adee591296e90b9802410f17cfcecf",
          "completeness_sha256": "55706bb7177c31d0b21a93023995acf8af0e47a570913cad6c68b7fc0af56500",
          "data_quality_sha256": "b2520349fe7e606950ae3d459dd1f02c3fdc34cf8ef167ef87ca38dcac5a2fdd",
          "freshness_sha256": "f5354207295b0460efe4a3ed41d5e52c842729184f0be30b1fd8af66489b66b9",
          "input_sha256": "4931ba38f0020f80d477b73726767caa62c42898ce94b0204a98c9b691d38665",
          "journey_sha256": "dc2a54ee0afb652bf16e10a422c58e08c9daa3f7dbe57fd6cc584aacabdd2dbf",
          "output_sha256": "76af48af35ed8c242e5ecf0df5d011f1c77bf663bf711cc77e2a36e0409a0cd0",
          "privacy_sha256": "c029313d51a3707637292a87c06749dc8a561e743314095f9e51130a5c5451d1",
          "request_count": 1
        },
        "candidate": {
          "allowed_claims_sha256": "34ebc8c02f94cdbc106c082fb9adf1bd09adee591296e90b9802410f17cfcecf",
          "completeness_sha256": "55706bb7177c31d0b21a93023995acf8af0e47a570913cad6c68b7fc0af56500",
          "data_quality_sha256": "b2520349fe7e606950ae3d459dd1f02c3fdc34cf8ef167ef87ca38dcac5a2fdd",
          "freshness_sha256": "f5354207295b0460efe4a3ed41d5e52c842729184f0be30b1fd8af66489b66b9",
          "input_sha256": "4931ba38f0020f80d477b73726767caa62c42898ce94b0204a98c9b691d38665",
          "journey_sha256": "dc2a54ee0afb652bf16e10a422c58e08c9daa3f7dbe57fd6cc584aacabdd2dbf",
          "output_sha256": "76af48af35ed8c242e5ecf0df5d011f1c77bf663bf711cc77e2a36e0409a0cd0",
          "privacy_sha256": "c029313d51a3707637292a87c06749dc8a561e743314095f9e51130a5c5451d1",
          "request_count": 1
        },
        "case_id": "empty"
      },
      {
        "baseline": {
          "allowed_claims_sha256": "34ebc8c02f94cdbc106c082fb9adf1bd09adee591296e90b9802410f17cfcecf",
          "completeness_sha256": "55706bb7177c31d0b21a93023995acf8af0e47a570913cad6c68b7fc0af56500",
          "data_quality_sha256": "b2520349fe7e606950ae3d459dd1f02c3fdc34cf8ef167ef87ca38dcac5a2fdd",
          "freshness_sha256": "f5354207295b0460efe4a3ed41d5e52c842729184f0be30b1fd8af66489b66b9",
          "input_sha256": "4931ba38f0020f80d477b73726767caa62c42898ce94b0204a98c9b691d38665",
          "journey_sha256": "38501fc84396ef59f25a2f32009eaba64c943f42d6f634603b97b7d231ec5424",
          "output_sha256": "54dabe5d8f651928e333943d3e2b250be2a6c574e87542cc169df3db140a54a3",
          "privacy_sha256": "2935cd6c17637c012dedc46a16a0da21b6f3e6ba65b7e3dff940304dd92afab5",
          "request_count": 1
        },
        "candidate": {
          "allowed_claims_sha256": "34ebc8c02f94cdbc106c082fb9adf1bd09adee591296e90b9802410f17cfcecf",
          "completeness_sha256": "55706bb7177c31d0b21a93023995acf8af0e47a570913cad6c68b7fc0af56500",
          "data_quality_sha256": "b2520349fe7e606950ae3d459dd1f02c3fdc34cf8ef167ef87ca38dcac5a2fdd",
          "freshness_sha256": "f5354207295b0460efe4a3ed41d5e52c842729184f0be30b1fd8af66489b66b9",
          "input_sha256": "4931ba38f0020f80d477b73726767caa62c42898ce94b0204a98c9b691d38665",
          "journey_sha256": "38501fc84396ef59f25a2f32009eaba64c943f42d6f634603b97b7d231ec5424",
          "output_sha256": "54dabe5d8f651928e333943d3e2b250be2a6c574e87542cc169df3db140a54a3",
          "privacy_sha256": "2935cd6c17637c012dedc46a16a0da21b6f3e6ba65b7e3dff940304dd92afab5",
          "request_count": 1
        },
        "case_id": "contract_drift"
      },
      {
        "baseline": {
          "allowed_claims_sha256": "34ebc8c02f94cdbc106c082fb9adf1bd09adee591296e90b9802410f17cfcecf",
          "completeness_sha256": "55706bb7177c31d0b21a93023995acf8af0e47a570913cad6c68b7fc0af56500",
          "data_quality_sha256": "b2520349fe7e606950ae3d459dd1f02c3fdc34cf8ef167ef87ca38dcac5a2fdd",
          "freshness_sha256": "f5354207295b0460efe4a3ed41d5e52c842729184f0be30b1fd8af66489b66b9",
          "input_sha256": "4931ba38f0020f80d477b73726767caa62c42898ce94b0204a98c9b691d38665",
          "journey_sha256": "121665a002362804163d853f327f083590384ed0f38059f0a7224ed3afd95212",
          "output_sha256": "9873a015999e0af986ecc1dbe9bbda65158bf19962a51a353b1c1b7ce6804ed4",
          "privacy_sha256": "773df508187dbe087f515b01abc0ec87f2db20092b54d6d342afd7468eb9e368",
          "request_count": 1
        },
        "candidate": {
          "allowed_claims_sha256": "34ebc8c02f94cdbc106c082fb9adf1bd09adee591296e90b9802410f17cfcecf",
          "completeness_sha256": "55706bb7177c31d0b21a93023995acf8af0e47a570913cad6c68b7fc0af56500",
          "data_quality_sha256": "b2520349fe7e606950ae3d459dd1f02c3fdc34cf8ef167ef87ca38dcac5a2fdd",
          "freshness_sha256": "f5354207295b0460efe4a3ed41d5e52c842729184f0be30b1fd8af66489b66b9",
          "input_sha256": "4931ba38f0020f80d477b73726767caa62c42898ce94b0204a98c9b691d38665",
          "journey_sha256": "121665a002362804163d853f327f083590384ed0f38059f0a7224ed3afd95212",
          "output_sha256": "9873a015999e0af986ecc1dbe9bbda65158bf19962a51a353b1c1b7ce6804ed4",
          "privacy_sha256": "773df508187dbe087f515b01abc0ec87f2db20092b54d6d342afd7468eb9e368",
          "request_count": 1
        },
        "case_id": "runtime_failure"
      }
    ],
    "corpus_id": "analysis-query-event.variant-equivalence@1",
    "corpus_sha256": "6d4d56aeb30cee49d61dc3c55a799ae4d771ddbfd1859573d6f5b5f54681e3f5"
  },
  "current_trust": {
    "contract_digest": "76342fbd1eaebf3f9f23c506badd5c76d5e163d300c16aec1daf33ce498640dd",
    "reason_codes": [],
    "trust_status": "not_evaluated"
  },
  "dimensions": {
    "allowed_claims": "equivalent",
    "completeness": "equivalent",
    "data_quality": "equivalent",
    "freshness": "equivalent",
    "input_semantics": "equivalent",
    "journey_regression": "equivalent",
    "output_semantics": "equivalent",
    "privacy": "equivalent",
    "request_count": "equivalent"
  },
  "equivalent": true,
  "fixed": true,
  "mismatches": [],
  "network_called": false,
  "product": {
    "contract_digest": "76342fbd1eaebf3f9f23c506badd5c76d5e163d300c16aec1daf33ce498640dd",
    "contract_version": "1",
    "identity_kind": "product",
    "selector": "analysis.query.spec:event"
  },
  "rollback": {
    "canonical_variant_uri": "gravity.execution-variant/analysis-query-event/direct@1",
    "capability_preserved": true,
    "strategy": "pin_canonical_direct"
  },
  "schema_version": "gravity.execution-variant-characterization.v1",
  "selection_status": "disabled_until_r14_d",
  "variants": [
    {
      "descriptor_sha256": "214f24080e4e86c6fafa07a44d29cdf24acebb583a6fa6ae0ca938552bd6f5f4",
      "variant_uri": "gravity.execution-variant/analysis-query-event/direct@1"
    },
    {
      "descriptor_sha256": "8107a2d165949402c51d24050f95c4473c7069850770a92492c133df00bef028",
      "variant_uri": "gravity.execution-variant/analysis-query-event/plan-adapter@1"
    }
  ]
}
